{
  "source": "defend",
  "account_id": "123456789012",
  "region": "global",
  "timestamp": "2026-03-06T00:00:00Z",
  "summary": {
    "scps_generated": 1,
    "rcps_generated": 0,
    "detections_generated": 1,
    "controls_recommended": 1,
    "risk_score": "high"
  },
  "audit_runs_analyzed": ["audit-20260306-000000-all"],
  "scps": [{"name": "test-scp", "file": "policies/test.json", "policy_json": {"Version": "2012-10-17", "Statement": []}, "source_attack_paths": ["p1"], "source_run_ids": ["r1"], "impact_analysis": {"prevents": ["p1"], "blast_radius": "low", "affected_services": ["iam"], "break_glass": "Remove SCP"}}],
  "rcps": [],
  "detections": [{"name": "test-det", "spl": "index=cloudtrail", "severity": "high", "category": "privilege_escalation", "mitre_technique": "T1078", "source_attack_paths": ["p1"], "source_run_ids": ["r1"]}],
  "security_controls": [{"service": "iam", "recommendation": "Enable MFA", "priority": "high", "effort": "low", "source_attack_paths": ["p1"]}],
  "prioritization": [{"rank": 1, "action": "Enable MFA", "risk": "high", "effort": "low", "category": "control"}]
}
